{
  "version": "1.2.0",
  "llm": {
    "base_url": "http://localhost:9180/v1",
    "model": "Qwen/Qwen3.5-35B",
    "mcp_url": "http://localhost:8084",
    "timeout_seconds": 120,
    "max_retries": 3,
    "fallback": {
      "enabled": true,
      "circuit_breaker_threshold": 5,
      "circuit_breaker_reset_seconds": 60,
      "retry_backoff_base": 2.0,
      "manual_queue_enabled": true
    }
  },
  "generation": {
    "target_count": 100000,
    "complexity_ratio": 0.5,
    "best_of_n": 5,
    "enable_critic": true,
    "batch_size": 100,
    "temperature": 0.9
  },
  "taxonomy": {
    "max_depth": 4,
    "min_completeness": 0.7,
    "min_soundness": 0.9
  },
  "evaluation": {
    "complexity": {"batch_size": 5, "n_samples": 5, "enable_elo": true, "elo_k_factor": 32},
    "coverage": {"max_level": 4, "sample_size": 1000, "gap_threshold": 0.5},
    "diversity": {"embedding_model": "sentence-transformers/all-MiniLM-L6-v2", "knn_k": 10, "target_global": 0.52, "target_local": 0.2},
    "critic_validation": {"validation_split": 0.05, "max_samples": 200, "target_p_y": 0.8, "target_p_corrupt": 0.3}
  },
  "output": {
    "directory": "data/training/",
    "format": "jsonl",
    "include_rejected": true
  },
  "reproducibility": {
    "commit": "b8d40a1",
    "tag": "simula-v1.2-worked-example",
    "seed": 20251115,
    "generated_at": "2026-04-15T12:00:00+00:00"
  },
  "hana_spatial_policy": "strict",
  "roadmap": {
    "domain": "simula",
    "milestones": ["M04", "M05", "M06"],
    "priority": "Must",
    "roadmap_chapter": "Ch 10"
  }
}
